"10.1093/database/baae087", "Recognition and normalization of multilingual symptom entities using in-domain-adapted BERT models and classification layers.", "Database J. Biol. Databases Curation", "2024", "Fernando Gallego Donoso, Francisco J. Veredas 0001", "journals/biodb/DonosoV24", "Journal Articles"
"10.1093/nar/gkz872", "VDJbase: an adaptive immune receptor genotype and haplotype database.", "Nucleic Acids Res.", "2020", "Aviv Omer, Or Shemesh, Ayelet Peres, Pazit Polak, Adrian J. Shepherd, Corey T. Watson, Scott D. Boyd, Andrew M. Collins, William D. Lees, Gur Yaari", "journals/nar/OmerSPPSWBCLY20", "Journal Articles"
"10.1093/nar/gky983", "ALEdb 1.0: a database of mutations from adaptive laboratory evolution experimentation.", "Nucleic Acids Res.", "2019", "Patrick V. Phaneuf, Dennis Gosting, Bernhard O. Palsson, Adam M. Feist", "journals/nar/PhaneufGPF19", "Journal Articles"
"10.1093/database/baw156", "BELMiner: adapting a rule-based relation extraction system to extract biological expression language statements from bio-medical literature evidence sentences.", "Database J. Biol. Databases Curation", "2017", "K. E. Ravikumar, Majid Rastegar-Mojarad, Hongfang Liu", "journals/biodb/RavikumarRL17", "Journal Articles"
"10.1093/database/baw135", "NERChem: adapting NERBio to chemical patents via full-token features and named entity feature with chemical sub-class composition.", "Database J. Biol. Databases Curation", "2016", "Richard Tzong-Han Tsai, Yu-Cheng Hsiao, Po-Ting Lai", "journals/biodb/TsaiHL16", "Journal Articles"
"10.1504/ijiids.2025.143488", "A novel heuristically adaptive dual attention-based long short-term memory for intelligent stock market trend prediction model.", "Int. J. Intell. Inf. Database Syst.", "2025", "Anuja Jana Naik, Madanant Jana Naik", "journals/ijiids/NaikN25", "Journal Articles"
"10.48550/arxiv.2505.04404", "In-Context Adaptation to Concept Drift for Learned Database Operations.", "CoRR", "2025", "Jiaqi Zhu 0002, Shaofeng Cai, Yanyan Shen, Gang Chen 0001, Fang Deng, Beng Chin Ooi", "journals/corr/abs-2505-04404", "Informal and Other Publications"
"10.48550/arxiv.2507.22943", "A chart review process aided by natural language processing and multi-wave adaptive sampling to expedite validation of code-based algorithms for large database studies.", "CoRR", "2025", "Shirley V. Wang, Georg Hahn, Sushama Kattinakere Sreedhara, Mufaddal Mahesri, Haritha S. Pillai, Rajendra Aldis, Joyce Lii, Sarah K. Dutcher, Rhoda Eniafe, Jamal T. Jones, Keewan Kim, Jiwei He, Hana Lee, Sengwee Toh, Rishi J. Desai, Jie Yang", "journals/corr/abs-2507-22943", "Informal and Other Publications"
"10.48550/arxiv.2509.23471", "Drift-Adapter: A Practical Approach to Near Zero-Downtime Embedding Model Upgrades in Vector Databases.", "CoRR", "2025", "Harshil Vejendla", "journals/corr/abs-2509-23471", "Informal and Other Publications"
"10.1007/s10619-023-07437-x", "Balanced parallel triangle enumeration with an adaptive algorithm.", "Distributed Parallel Databases", "2024", "Abir Farouzi, Xiantian Zhou, Ladjel Bellatreche, Mimoun Malki, Carlos Ordonez 0001", "journals/dpd/FarouziZBMO24", "Journal Articles"
"10.1504/ijiids.2024.141745", "Intelligent rainfall forecasting model: heuristic assisted adaptive deep temporal convolutional network with optimal feature selection.", "Int. J. Intell. Inf. Database Syst.", "2024", "Nishant Nilkanth Pachpor, B. Suresh Kumar, Prakash S. Prasad, Salim G. Shaikh", "journals/ijiids/PachporKPS24", "Journal Articles"
"10.1504/ijiids.2024.137666", "An adaptive fuzzy weight algorithm for the class imbalance learning problem.", "Int. J. Intell. Inf. Database Syst.", "2024", "Vo Duc Quang, Tran Dinh Khang", "journals/ijiids/QuangK24", "Journal Articles"
"10.1109/tie.2023.3296764", "Adaptive-Optimization-Based Digital Simulation Database for Nonuniform Aging Diagnosis of Transformer Insulation System.", "IEEE Trans. Ind. Electron.", "2024", "Xianhao Fan, Fangwei Liang, Hanhua Luo, Chuanyang Li, Jiefeng Liu, Jinliang He", "journals/tie/FanLLLLH24", "Journal Articles"
"10.48550/arxiv.2403.09588", "Iterative Forgetting: Online Data Stream Regression Using Database-Inspired Adaptive Granulation.", "CoRR", "2024", "Niket Kathiriya, Hossein Haeri, Cindy Chen, Kshitij Jerath", "journals/corr/abs-2403-09588", "Informal and Other Publications"
"10.48550/arxiv.2405.18670", "Adapting Differentially Private Synthetic Data to Relational Databases.", "CoRR", "2024", "Kaveh Alimohammadi, Hao Wang, Ojas Gulati, Akash Srivastava, Navid Azizan", "journals/corr/abs-2405-18670", "Informal and Other Publications"
"10.48550/arxiv.2412.12961", "Adaptations of AI models for querying the LandMatrix database in natural language.", "CoRR", "2024", "Fatiha Ait Kbir, Jérémy Bourgoin, Rémy Decoupes, Marie Gradeler, Roberto Interdonato", "journals/corr/abs-2412-12961", "Informal and Other Publications"
"10.1007/s10619-023-07428-y", "Adaptive update handling for graph HTAP.", "Distributed Parallel Databases", "2023", "Muhammad Attahir Jibril, Alexander Baumstark, Kai-Uwe Sattler", "journals/dpd/JibrilBS23", "Journal Articles"
"10.1504/ijaacs.2023.131627", "Unsupervised clustering algorithm for databases based on density peak optimisation.", "Int. J. Auton. Adapt. Commun. Syst.", "2023", "Xiaochuan Pu, Wonchul Seo, Qingqiang Ruan", "journals/ijaacs/PuSR23", "Journal Articles"
"10.4018/jdm.323436", "Adaptive Modularized Recurrent Neural Networks for Electric Load Forecasting.", "J. Database Manag.", "2023", "Fangwan Huang, Shijie Zhuang, Zhiyong Yu 0001, Yuzhong Chen 0001, Kun Guo 0003", "journals/jdm/HuangZ0CG23", "Journal Articles"
"10.1109/tie.2022.3204953", "Industrial UAV-Based Unsupervised Domain Adaptive Crack Recognitions: From Database Towards Real-Site Infrastructural Inspections.", "IEEE Trans. Ind. Electron.", "2023", "Kangcheng Liu, Ben M. Chen", "journals/tie/LiuC23", "Journal Articles"
"10.1016/j.vrih.2022.03.006", "Adaptive spatio-temporal attention neural network for cross-database micro-expression recognition.", "Virtual Real. Intell. Hardw.", "2023", "Yuhan Ran", "journals/vrih/Ran23", "Journal Articles"
"10.5281/zenodo.8107994", "How to be flexible - OpenAtlas as Highly Adaptable Database Software in the Scope of Digital Humanities.", "DH", "2023", "Alexander Watzinger, Bernhard Koschicek-Krombholz, Andreas Olschnögger, Christoph Hoffmann, Moritz Großfurtner", "conf/dihu/WatzingerKOHG23", "Conference and Workshop Papers"
"10.48550/arxiv.2302.04097", "ASTRIDE: Adaptive Symbolization for Time Series Databases.", "CoRR", "2023", "Sylvain W. Combettes, Charles Truong, Laurent Oudre", "journals/corr/abs-2302-04097", "Informal and Other Publications"
"10.48550/arxiv.2306.04433", "Cross-Database and Cross-Channel ECG Arrhythmia Heartbeat Classification Based on Unsupervised Domain Adaptation.", "CoRR", "2023", "Md. Niaz Imtiaz, Naimul Khan 0001", "journals/corr/abs-2306-04433", "Informal and Other Publications"
"10.48550/arxiv.2308.09313", "Domain Adaptive Code Completion via Language Models and Decoupled Domain Databases.", "CoRR", "2023", "Ze Tang 0002, Jidong Ge, Shangqing Liu, Tingwei Zhu, Tongtong Xu, Liguo Huang, Bin Luo 0003", "journals/corr/abs-2308-09313", "Informal and Other Publications"
"10.48550/arxiv.2311.07826", "Adaptive Search Optimization: Dynamic Algorithm Selection and Caching for Enhanced Database Performance.", "CoRR", "2023", "Hakikat Singh", "journals/corr/abs-2311-07826", "Informal and Other Publications"
"10.1093/jigpal/jzaa030", "Evolutionary Reinforcement Learning for Adaptively Detecting Database Intrusions.", "Log. J. IGPL", "2022", "", "journals/igpl/X22a", "Journal Articles"
"10.1504/ijaacs.2022.123456", "Integration method of wireless sensor network ciphertext database based on internet of things.", "Int. J. Auton. Adapt. Commun. Syst.", "2022", "Xuehong Liu, Xuefeng Ding", "journals/ijaacs/LiuD22", "Journal Articles"
"10.48550/arxiv.2209.02334", "An Adaptive Column Compression Family for Self-Driving Databases.", "CoRR", "2022", "Marcell Fehér, Daniel E. Lucani, Ioannis Chatzigeorgiou", "journals/corr/abs-2209-02334", "Informal and Other Publications"
"10.48550/arxiv.2210.16613", "Diverse Parallel Data Synthesis for Cross-Database Adaptation of Text-to-SQL Parsers.", "CoRR", "2022", "Abhijeet Awasthi, Ashutosh Sathe, Sunita Sarawagi", "journals/corr/abs-2210-16613", "Informal and Other Publications"
"10.1007/s10619-020-07319-6", "Prefetched wald adaptive boost classification based Czekanowski similarity MapReduce for user query processing with bigdata.", "Distributed Parallel Databases", "2021", "S. Tamil Selvan, P. Balamurugan 0002, M. Vijayakumar", "journals/dpd/SelvanBV21", "Journal Articles"
"10.1093/jigpal/jzz053", "Evolutionary Reinforcement Learning for Adaptively Detecting Database Intrusions.", "Log. J. IGPL", "2020", "Seul-Gi Choi, Sung-Bae Cho", "journals/igpl/ChoiC20", "Journal Articles"
"10.1504/ijiids.2020.109471", "Lorentzian adaptive filter for controlling shunt compensator to mitigate power quality problems of solar PV interconnected with grid.", "Int. J. Intell. Inf. Database Syst.", "2020", "Bellamkonda Pragathi, Deepak Kumar Nayak, Ramesh Chandra Poonia", "journals/ijiids/PragathiNP20", "Journal Articles"
"10.1016/j.ijmedinf.2019.104065", "Multilanguage health record database focused on the active follow-up of patients and adaptable for patient-reported outcomes and clinical research design.", "Int. J. Medical Informatics", "2020", "Leonardo Pellizzoni, Scheila de Avila e Silva, Asdrubal Falavigna", "journals/ijmi/PellizzoniSF20", "Journal Articles"
"10.1145/3397491", "Adaptive Asynchronous Parallelization of Graph Algorithms.", "ACM Trans. Database Syst.", "2020", "Wenfei Fan, Ping Lu 0005, Wenyuan Yu, Jingbo Xu 0001, Qiang Yin 0002, Xiaojian Luo, Jingren Zhou 0001, Ruochun Jin", "journals/tods/FanLYXYLZJ20", "Journal Articles"
"10.1093/nar/gky959", "PopHumanScan: the online catalog of human genome adaptation.", "Nucleic Acids Res.", "2019", "Jesús Murga-Moreno, Marta Coronado-Zamora, Alejandra Bodelón, Antonio Barbadilla, Sònia Casillas", "journals/nar/Murga-MorenoCBB19", "Journal Articles"
"10.1016/j.jag.2018.03.001", "A scale self-adapting segmentation approach and knowledge transfer for automatically updating land use/cover change databases using high spatial resolution images.", "Int. J. Appl. Earth Obs. Geoinformation", "2018", "Zhihua Wang 0006, Xiaomei Yang, Chen Lu, Fengshuo Yang", "journals/aeog/WangYLY18", "Journal Articles"
"10.1007/s10619-017-7210-4", "MetaStore: an adaptive metadata management framework for heterogeneous metadata models.", "Distributed Parallel Databases", "2018", "Ajinkya Prabhune, Rainer Stotzka, Vaibhav Sakharkar, Jürgen Hesser, Michael Gertz 0001", "journals/dpd/PrabhuneSSHG18", "Journal Articles"
"10.1007/s10619-017-7215-z", "An adaptive multi-objective evolutionary algorithm for constrained workflow scheduling in Clouds.", "Distributed Parallel Databases", "2018", "Miao Zhang 0022, Huiqi Li, Li Liu 0026, Rajkumar Buyya", "journals/dpd/ZhangLLB18", "Journal Articles"
"10.1145/3095891", "Performance and Cost Considerations for Providing Geo-Elasticity in Database Clouds.", "ACM Trans. Auton. Adapt. Syst.", "2018", "Tian Guo 0001, Prashant J. Shenoy", "journals/taas/GuoS18", "Journal Articles"
"10.1109/tbc.2018.2822870", "A Quality-of-Experience Database for Adaptive Video Streaming.", "IEEE Trans. Broadcast.", "2018", "Zhengfang Duanmu, Abdul Rehman 0001, Zhou Wang 0001", "journals/tbc/DuanmuRW18", "Journal Articles"
"10.1145/3276980", "Optimal Bloom Filters and Adaptive Merging for LSM-Trees.", "ACM Trans. Database Syst.", "2018", "Niv Dayan, Manos Athanassoulis, Stratos Idreos", "journals/tods/DayanAI18", "Journal Articles"
"10.1007/978-3-030-04834-1_1", "From Cyber Situational Awareness to Adaptive Cyber Defense: Leveling the Cyber Playing Field.", "From Database to Cyber Security", "2018", "Massimiliano Albanese", "conf/birthday/Albanese18", "Conference and Workshop Papers"
"10.1109/upinlbs.2018.8559726", "A novel adaptive weighted K-nearest neighbor positioning method based on omnidirectional fingerprint database and twice affinity propagation clustering.", "UPINLBS", "2018", "Jingxue Bi, Yunjia Wang 0004, Xin Li 0031, Hongxia Qi, Hongji Cao, Shenglei Xu", "conf/upinlbs/BiWLQCX18", "Conference and Workshop Papers"
"10.1007/978-1-4614-8265-9_11", "Adaptive Stream Processing.", "Encyclopedia of Database Systems", "2018", "Zachary G. Ives", "reference/db/Ives18", "Reference Works"
"10.1007/978-1-4614-8265-9_5016", "Adaptive Interfaces.", "Encyclopedia of Database Systems", "2018", "Maristella Matera", "reference/db/Matera18", "Reference Works"
"10.1007/978-1-4614-8265-9_865", "Adaptive Query Processing.", "Encyclopedia of Database Systems", "2018", "Evaggelia Pitoura", "reference/db/Pitoura18a", "Reference Works"
"10.1007/978-1-4614-8265-9_855", "View Adaptation.", "Encyclopedia of Database Systems", "2018", "Kenneth A. Ross", "reference/db/Ross18a", "Reference Works"
"10.1007/978-1-4614-8265-9_1540", "Adaptive Middleware for Message Queuing Systems.", "Encyclopedia of Database Systems", "2018", "Christophe Taton, Noël De Palma, Sara Bouchenak", "reference/db/TatonPB18", "Reference Works"
"10.1142/s2424922x17500061", "4D Visual Delivery of Big Climate Data: A Fast Web Database Application System.", "Adv. Data Sci. Adapt. Anal.", "2017", "Julien Pierret, Samuel S. P. Shen", "journals/aada/PierretS17", "Journal Articles"
"10.1007/s10619-017-7192-2", "An I/O-efficient and adaptive fault-tolerant framework for distributed graph computations.", "Distributed Parallel Databases", "2017", "Zhigang Wang 0001, Yu Gu 0002, Yubin Bao, Ge Yu 0001, Lixin Gao 0001", "journals/dpd/WangGBYG17", "Journal Articles"
"10.1504/ijiids.2017.10007348", "Using logic programming for adapting models to metamodel evolution.", "Int. J. Intell. Inf. Database Syst.", "2017", "Fouzia Anguel, Abdelkrim Amirat, Nora Bounour", "journals/ijiids/AnguelAB17", "Journal Articles"
"10.1016/j.ijmedinf.2017.05.016", "Adaptable pattern recognition system for discriminating Melanocytic Nevi from Malignant Melanomas using plain photography images from different image databases.", "Int. J. Medical Informatics", "2017", "Spiros Kostopoulos, Pantelis A. Asvestas, Ioannis Kalatzis, George Sakellaropoulos, Theofilos H. Sakkis, Dionisis A. Cavouras, Dimitris T. Glotsos", "journals/ijmi/KostopoulosAKSS17", "Journal Articles"
"10.4018/jdm.2017100101", "Adapting Agile Practices for Data Warehousing, Business Intelligence, and Analytics.", "J. Database Manag.", "2017", "Dinesh Batra", "journals/jdm/Batra17", "Journal Articles"
"10.4018/ijaras.2015070104", "Analysis of the Join Performance in Vertically Distributed Cloud Databases.", "Int. J. Adapt. Resilient Auton. Syst.", "2015", "Jens Kohler, Kiril Simov, Thomas Specht", "journals/ijaras/KohlerSS15", "Journal Articles"
"10.1504/ijbdi.2015.069095", "Robust fingerprinting codes for database using non-adaptive group testing.", "Int. J. Big Data Intell.", "2015", "Thach V. Bui, Binh Q. Nguyen, Thuc Dinh Nguyen, Noboru Sonehara, Isao Echizen", "journals/ijbdi/BuiNNSE15", "Journal Articles"
"10.1007/978-3-319-16211-9_16", "Adaptation of Social Network Analysis to Electronic Freight Exchange.", "New Trends in Intelligent Information and Database Systems", "2015", "Konrad Fuks, Arkadiusz Kawa, Bartlomiej Pieranski", "series/sci/FuksKP15", "Parts in Books or Collections"
"10.1504/ijiids.2014.060463", "Intelligent adaptation for UEC video/voice over IP with access control.", "Int. J. Intell. Inf. Database Syst.", "2014", "Bao Rong Chang, Chi-Ming Chen, Chien-Feng Huang, Hsiu Fen Tsai", "journals/ijiids/ChangCHT14", "Journal Articles"
"10.1016/j.procs.2014.09.064", "Assessing the Auto Associative Network Approach for Prediction in Civil Engineering Databases.", "Complex Adaptive Systems", "2014", "Hakan Yasarer, Yacoub Najjar", "conf/complexsystems/YasarerN14", "Conference and Workshop Papers"
"10.1109/fskd.2014.6980907", "Adaptively incremental dictionary compression method for column-oriented database.", "FSKD", "2014", "Hui Liu, Zhijing Liu, Tong Yuan, Yong Yao", "conf/fskd/LiuLYY14", "Conference and Workshop Papers"
"10.1007/s10619-012-7093-3", "Adaptive data acquisition strategies for energy-efficient, smartphone-based, continuous processing of sensor streams.", "Distributed Parallel Databases", "2013", "Lipyeow Lim, Archan Misra, Tianli Mo", "journals/dpd/LimMM13", "Journal Articles"
"10.1504/ijiids.2013.057424", "Research on adaptive classification algorithm based on non-segment and classified-centre-vector.", "Int. J. Intell. Inf. Database Syst.", "2013", "Kai Gao, Xiang Wang, Wei Wang", "journals/ijiids/GaoWW13", "Journal Articles"
"10.1504/ijiids.2013.057419", "Adaptive image restoration by a novel neuro-fuzzy approach using complex fuzzy sets.", "Int. J. Intell. Inf. Database Syst.", "2013", "Chunshien Li", "journals/ijiids/Li13", "Journal Articles"
"10.3233/978-1-61499-289-9-1083", "Exploring Barriers for Health Visitors&apos; Adaption of the Danish Children&apos;s Database.", "MedInfo", "2013", "Louise Pape-Haugaard, Karin Haugaard, Per Carøe, Anna Marie Høstgaard", "conf/medinfo/Pape-HaugaardHCH13", "Conference and Workshop Papers"
"10.1007/s10619-011-7086-7", "Satisfaction-based query replication - An automatic and self-adaptable approach for replicating queries in the presence of autonomous participants.", "Distributed Parallel Databases", "2012", "Jorge-Arnulfo Quiané-Ruiz, Philippe Lamarre, Patrick Valduriez", "journals/dpd/Quiane-RuizLV12", "Journal Articles"
"10.1504/ijiids.2012.049312", "Biomedical user adaptive system for smart environments.", "Int. J. Intell. Inf. Database Syst.", "2012", "Ondrej Krejcar, Dalibor Janckulík, Leona Motalova, Petr Czekaj", "journals/ijiids/KrejcarJMC12", "Journal Articles"
"10.11575/prism/4503", "A bounded and adaptive memory based approach to mine frequent patterns from huge databases.", "undefined", "2011", "Muhaimenul Adnan", "phd/basesearch/Adnan11", "Books and Theses"
"10.1504/ijiids.2011.040086", "An agent model integrating an adaptive model for environmental dynamics.", "Int. J. Intell. Inf. Database Syst.", "2011", "Jan Treur, Muhammad Umair", "journals/ijiids/TreurU11", "Journal Articles"
"10.1007/978-1-4614-4951-5_41", "Adaptive Model-Driven Information Systems Development for Object Databases.", "ISD", "2011", "Tilmann Zäschke, Christoph Zimmerli, Stefania Leone, Minh K. Nguyen, Moira C. Norrie", "conf/isdevel/ZaschkeZLNN11", "Conference and Workshop Papers"
"10.1016/j.procs.2011.08.022", "Estimating Power/Energy Consumption in Database Servers.", "Complex Adaptive Systems", "2011", "Manuel Rodríguez-Martínez, Harold Valdivia, Jaime Seguel, Melvin Greer", "journals/procedia/Rodriguez-MartinezVSG11", "Conference and Workshop Papers"
"10.1007/s10619-010-7063-6", "E-ARL: An Economic incentive scheme for Adaptive Revenue-Load-based dynamic replication of data in Mobile-P2P networks.", "Distributed Parallel Databases", "2010", "Anirban Mondal, Sanjay Kumar Madria, Masaru Kitsuregawa", "journals/dpd/MondalMK10", "Journal Articles"
"10.1007/s10619-010-7067-2", "Cardinality estimation and dynamic length adaptation for Bloom filters.", "Distributed Parallel Databases", "2010", "Odysseas Papapetrou, Wolf Siberski, Wolfgang Nejdl", "journals/dpd/PapapetrouSN10", "Journal Articles"
"10.1287/isre.1080.0189", "Is Query Reuse Potentially Harmful? Anchoring and Adjustment in Adapting Existing Database Queries.", "Inf. Syst. Res.", "2010", "Gove Allen, Jeffrey Parsons", "journals/isr/AllenP10", "Journal Articles"
"10.1524/itit.2010.0570", "Effiziente Ähnlichkeitssuche und Data Mining in großen Multimediadatenbanken (Efficient Adaptive Retrieval and Mining in Large Multimedia Databases).", "it Inf. Technol.", "2010", "Ira Assent", "journals/it/Assent10", "Journal Articles"
"10.1108/07378831011096240", "Overcoming the information gap: Measuring the accessibility of library databases to adaptive technology users.", "Libr. Hi Tech", "2010", "Jennifer Tatomir, Joan C. Durrance", "journals/lht/TatomirD10", "Journal Articles"
"10.14778/1920841.1920935", "An Adaptive Updating Protocol for Reducing Moving Object Databases Workload.", "Proc. VLDB Endow.", "2010", "Su Chen, Beng Chin Ooi, Zhenjie Zhang", "journals/pvldb/ChenOZ10", "Journal Articles"
"10.1007/978-3-642-27169-4_13", "Proximity-Based Order-Respecting Intersection for Searching in Image Databases.", "Adaptive Multimedia Retrieval", "2010", "Tomas Homola, Vlastislav Dohnal, Pavel Zezula", "conf/amr/HomolaDZ10", "Conference and Workshop Papers"
"10.1109/apweb.2010.23", "Two Novel Adaptive Symbolic Representations for Similarity Search in Time Series Databases.", "APWeb", "2010", "Ninh D. Pham, Quang Loc Le, Tran Khanh Dang", "conf/apweb/PhamLD10", "Conference and Workshop Papers"
"10.1109/dasip.2010.5706252", "An in-memory monitoring database for self adaptive MP2SoCs.", "DASIP", "2010", "Etienne Faure, Gabriel Marchesan Almeida, Mounir Benabdenbi, Pascal Benoit, Fabien Clermidy, François Pêcheux, Gilles Sassatelli, Lionel Torres", "conf/dasip/FaureABBCPST10", "Conference and Workshop Papers"
"10.1109/icpr.2010.1038", "User Adaptive Clustering for Large Image Databases.", "ICPR", "2010", "Mohammad Mehdi Saboorian, Mansour Jamzad, Hamid R. Rabiee 0001", "conf/icpr/SaboorianJR10", "Conference and Workshop Papers"
"10.1109/ipdpsw.2010.5470760", "Enhancing adaptive middleware for quantum chemistry applications with a database framework.", "IPDPS Workshops", "2010", "Lakshminarasimhan Seshagiri, Meng-Shiou Wu, Masha Sosonkina, Zhao Zhang 0010, Mark S. Gordon, Michael W. Schmidt", "conf/ipps/SeshagiriWSZGS10", "Conference and Workshop Papers"
"10.1109/ipta.2010.5586751", "Adaptive feature selection for heterogeneous image databases.", "IPTA", "2010", "Rostom Kachouri, Khalifa Djemal, Hichem Maaref", "conf/ipta/KachouriDM10", "Conference and Workshop Papers"
"10.1145/1838126.1838127", "Adaptive query scheduling for mixed database workloads with multiple objectives.", "DBTest", "2010", "Stefan Krompass, Harumi A. Kuno, Kevin Wilkinson, Umeshwar Dayal, Alfons Kemper", "conf/sigmod/KrompassKWDK10", "Conference and Workshop Papers"
"10.1109/wkdd.2010.121", "Optimizing Query Processing in Practical Software Database by Adapting.", "WKDD", "2010", "Mohammad-Reza Feizi-Derakhshi, Hasan Asil, Amir Asil, Elnaz Zafarani", "conf/wkdd/Feizi-DerakhshiAAZ10", "Conference and Workshop Papers"
"10.1007/978-3-642-12090-9_12", "An Adaptive Grid-Based Approach to Location Privacy Preservation.", "Advances in Intelligent Information and Database Systems", "2010", "Anh Tuan Truong, Quynh Chi Truong, Tran Khanh Dang", "series/sci/TruongTD10", "Parts in Books or Collections"
"10.1093/database/baae133", "A change language for ontologies and knowledge graphs.", "Database J. Biol. Databases Curation", "2025", "Harshad Hegde, Jennifer Vendetti, Damien Goutte-Gattat, J. Harry Caufield, John B. Graybeal, Nomi L. Harris, Naouel Karam, Christian Kindermann, Nicolas Matentzoglu, James A. Overton, Mark A. Musen, Christopher J. Mungall", "journals/biodb/HegdeVGCGHKKMOMM25", "Journal Articles"
"10.1093/database/baab059", "EpiSurf: metadata-driven search server for analyzing amino acid changes within epitopes of SARS-CoV-2 and other viral species.", "Database J. Biol. Databases Curation", "2021", "Anna Bernasconi 0002, Luca Cilibrasi, Ruba Al Khalaf, Tommaso Alfonsi, Stefano Ceri, Pietro Pinoli, Arif Canakoglu", "journals/biodb/BernasconiCKACP21", "Journal Articles"
"10.1093/database/bax100", "To increase trust, change the social design behind aggregated biodiversity data.", "Database J. Biol. Databases Curation", "2018", "Nico M. Franz, Beckett W. Sterner", "journals/biodb/FranzS18", "Journal Articles"
"10.1093/nar/gkw1188", "The 24th annual Nucleic Acids Research database issue: a look back and upcoming changes.", "Nucleic Acids Res.", "2017", "Michael Y. Galperin, Xosé M. Fernández-Suárez, Daniel J. Rigden", "journals/nar/GalperinFR17", "Journal Articles"
"10.1093/database/baw029", "CCProf: exploring conformational change profile of proteins.", "Database J. Biol. Databases Curation", "2016", "Che-Wei Chang, Chai-Wei Chou, Darby Tien-Hao Chang", "journals/biodb/ChangCC16", "Journal Articles"
"10.1093/database/bau080", "miRBase Tracker: keeping track of microRNA annotation changes.", "Database J. Biol. Databases Curation", "2014", "Gert Van Peer, Steve Lefever, Jasper Anckaert, Anneleen Beckers, Ali Rihani, Alan Van Goethem, Pieter-Jan Volders, Fjoralba Zeka, Maté Ongenaert, Pieter Mestdagh, Jo Vandesompele", "journals/biodb/PeerLABRGVZOMV14", "Journal Articles"
"10.1093/nar/gkr966", "PSCDB: a database for protein structural change upon ligand binding.", "Nucleic Acids Res.", "2012", "Takayuki Amemiya, Ryotaro Koike, Akinori Kidera, Motonori Ota", "journals/nar/AmemiyaKKO12", "Journal Articles"
"10.1093/database/bar049", "BioMart: driving a paradigm change in biological data management.", "Database J. Biol. Databases Curation", "2011", "Arek Kasprzyk", "journals/biodb/Kasprzyk11", "Journal Articles"
"10.48550/arxiv.2507.09225", "MetaClimage: A novel database of visual metaphors related to Climate Change, with costs and benefits analysis.", "CoRR", "2025", "Biagio Scalingi, Chiara Barattieri di San Pietro, Paolo Canal, Valentina Bambini", "journals/corr/abs-2507-09225", "Informal and Other Publications"
"10.48550/arxiv.2408.12414", "BIPeC: A Combined Change-Point Analyzer to Identify Performance Regressions in Large-scale Database Systems.", "CoRR", "2024", "Zhan Lyu, Thomas Bach 0001, Yong Li, Minh Le Nguyen, Lars Hömke", "journals/corr/abs-2408-12414", "Informal and Other Publications"
