"10.1093/nar/gkx1067", "miRTarBase update 2018: a resource for experimentally validated microRNA-target interactions.", "Nucleic Acids Res.", "2018", "Chih-Hung Chou, Sirjana Shrestha, Chi-Dung Yang, Nai-Wen Chang 0001, Yu-Ling Lin, Kuang-Wen Liao, Wei-Chih Huang 0002, Ting-Hsuan Sun, Siang-Jyun Tu, Wei-Hsiang Lee, Men-Yee Chiew, Chun-San Tai, Ting-Yen Wei, Tzi-Ren Tsai, Hsin-Tzu Huang, Chung-Yu Wang, Hsin-Yi Wu, Shu-Yi Ho, Pin-Rong Chen, Cheng-Hsun Chuang, Pei-Jung Hsieh, Yi-Shin Wu, Wen-Liang Chen, Meng-Ju Li, Yu-chun Wu, Xin-Yi Huang, Fung Ling Ng, Waradee Buddhakosai, Pei-Chun Huang, Kuan-Chun Lan, Chia-Yen Huang, Shun-Long Weng, Yeong-Nan Cheng, Chao Liang, Wen-Lian Hsu, Hsien-Da Huang", "journals/nar/ChouSYCLLHSTLCT18", "Journal Articles"
"10.1093/nar/gkx1025", "MNDR v2.0: an updated resource of ncRNA-disease associations in mammals.", "Nucleic Acids Res.", "2018", "Tianyu Cui, Lin Zhang 0057, Yan Huang, Ying Yi, Puwen Tan, Yue Zhao, Yongfei Hu, Liyan Xu, Enmin Li, Dong Wang 0011", "journals/nar/CuiZHYTZHXL018", "Journal Articles"
"10.1093/nar/gkx1081", "The Encyclopedia of DNA elements (ENCODE): data portal update.", "Nucleic Acids Res.", "2018", "Carrie A. Davis, Benjamin C. Hitz, Cricket A. Sloan, Esther T. Chan, Jean M. Davidson, Idan Gabdank, Jason A. Hilton, Kriti Jain, Ulugbek K. Baymuradov, Aditi K. Narayanan, Kathrina C. Onate, Keenan Graham, Stuart R. Miyasato, Timothy R. Dreszer, J. Seth Strattan, Otto Jolanki, Forrest Tanaka, J. Michael Cherry", "journals/nar/DavisHSCDGHJBNO18", "Journal Articles"
"10.1093/nar/gkx984", "Expanded and updated data and a query pipeline for iBeetle-Base.", "Nucleic Acids Res.", "2018", "Jürgen Dönitz, Lizzy Gerischer, Stefan Hahnke, Stefan Pfeiffer 0003, Gregor Bucher", "journals/nar/DonitzGHPB18", "Journal Articles"
"10.1093/nar/gkx1077", "The eukaryotic linear motif resource - 2018 update.", "Nucleic Acids Res.", "2018", "Marc Gouw, Sushama Michael, Hugo Sámano-Sánchez, Manjeet Kumar, András Zeke, Benjamin Lang 0001, Benoit Bely, Lucía B. Chemes, Norman E. Davey, Ziqi Deng, Francesca Diella, Clara-Marie Gürth, Ann-Kathrin Huber, Stefan Kleinsorg, Lara S. Schlegel, Nicolas Palopoli, Kim Van Roey, Brigitte Altenberg, Attila Reményi, Holger Dinkel, Toby J. Gibson", "journals/nar/GouwMSKZLBCDDDG18", "Journal Articles"
"10.1093/nar/gkx1068", "RefSeq: an update on prokaryotic genome annotation and curation.", "Nucleic Acids Res.", "2018", "Daniel H. Haft, Michael DiCuccio, Azat Badretdin, Vyacheslav Brover, Vyacheslav Chetvernin, Kathleen O&apos;Neill, Wenjun Li, Farideh Chitsaz, Myra K. Derbyshire, Noreen R. Gonzales, Marc Gwadz, Fu Lu, Gabriele H. Marchler, James S. Song, Narmada Thanki, Roxanne A. Yamashita, Chanjuan Zheng, Françoise Thibaud-Nissen, Lewis Y. Geer, Aron Marchler-Bauer, Kim D. Pruitt", "journals/nar/HaftDBBCOLCDGGL18", "Journal Articles"
"10.1093/nar/gkx1121", "The IUPHAR/BPS Guide to PHARMACOLOGY in 2018: updates and expansion to encompass the new guide to IMMUNOPHARMACOLOGY.", "Nucleic Acids Res.", "2018", "Simon D. Harding, Joanna L. Sharman, Elena Faccenda, Christopher Southan, Adam J. Pawson, Sam M. Ireland, Alasdair J. G. Gray, Liam Bruce, Stephen P. H. Alexander, Stephen Anderton, Clare Bryant, Anthony P. Davenport, Christian Doerig, Doriano Fabbro, Francesca Levi-Schaffer, Michael Spedding, Jamie A. Davies, NC-IUPHAR", "journals/nar/HardingSFSPIGBA18", "Journal Articles"
"10.1093/nar/gkx790", "GWIPS-viz: 2018 update.", "Nucleic Acids Res.", "2018", "Audrey M. Michel, Stephen J. Kiniry, Patrick B. F. O&apos;Connor, James P. A. Mullan, Pavel V. Baranov", "journals/nar/MichelKOMB18", "Journal Articles"
"10.1093/nar/gkx1130", "An update on sORFs.org: a repository of small ORFs identified by ribosome profiling.", "Nucleic Acids Res.", "2018", "Volodimir Olexiouk, Wim Van Criekinge, Gerben Menschaert", "journals/nar/OlexioukCM18", "Journal Articles"
"10.1093/nar/gkx1065", "SABIO-RK: an updated resource for manually curated biochemical reaction kinetics.", "Nucleic Acids Res.", "2018", "Ulrike Wittig, Maja Rey, Andreas Weidemann, Renate Kania, Wolfgang Müller 0001", "journals/nar/WittigRWK018", "Journal Articles"
"10.1093/nar/gkx1040", "PAGER 2.0: an update to the pathway, annotated-list and gene-signature electronic repository for Human Network Biology.", "Nucleic Acids Res.", "2018", "Zongliang Yue, Qi Zheng, Michael T. Neylon, Minjae Yoo, Jimin Shin, Zhiying Zhao, Aik Choon Tan, Jake Y. Chen", "journals/nar/YueZNYSZTC18", "Journal Articles"
"10.1093/nar/gkx1041", "iUUCD 2.0: an update with rich annotations for ubiquitin and ubiquitin-like conjugations.", "Nucleic Acids Res.", "2018", "Jiaqi Zhou 0003, Yang Xu 0072, Shaofeng Lin, Yaping Guo, Wankun Deng, Ying Zhang 0052, Anyuan Guo, Yu Xue 0001", "journals/nar/ZhouXLGDZGX18", "Journal Articles"
"10.1145/3183376", "Editorial: Updates to the Editorial Board.", "ACM Trans. Database Syst.", "2018", "Christian S. Jensen", "journals/tods/Jensen18", "Journal Articles"
"10.1007/978-1-4614-8265-9_791", "XML Updates.", "Encyclopedia of Database Systems", "2018", "Giorgio Ghelli", "reference/db/Ghelli18", "Reference Works"
"10.1007/978-1-4614-8265-9_1222", "Updates and Transactions in Peer-to-Peer Systems.", "Encyclopedia of Database Systems", "2018", "Zachary G. Ives", "reference/db/Ives18b", "Reference Works"
"10.1007/978-1-4614-8265-9_848", "Side-Effect-Free View Updates.", "Encyclopedia of Database Systems", "2018", "Yannis Velegrakis", "reference/db/Velegrakis18", "Reference Works"
"10.1007/978-1-4614-8265-9_847", "Updates Through Views.", "Encyclopedia of Database Systems", "2018", "Yannis Velegrakis", "reference/db/Velegrakis18a", "Reference Works"
"10.1016/j.jag.2016.09.004", "Geothopica and the interactive analysis and visualization of the updated Italian National Geothermal Database.", "Int. J. Appl. Earth Obs. Geoinformation", "2017", "Eugenio Trumpy, Adele Manzella", "journals/aeog/TrumpyM17", "Journal Articles"
"10.1093/nar/gkw1066", "HmtDB 2016: data update, a better performing query system and human mitochondrial DNA haplogroup predictor.", "Nucleic Acids Res.", "2017", "Rosanna Clima, Roberto Preste, Claudia Calabrese, Maria Angela Diroma, Mariangela Santorsola, Gaetano Scioscia, Domenico Simone, Lishuang Shen, Giuseppe Gasparre, Marcella Attimonelli", "journals/nar/ClimaPCDSSSSGA17", "Journal Articles"
"10.1093/nar/gkw1131", "CyanoBase: a large-scale update on its 20th anniversary.", "Nucleic Acids Res.", "2017", "Takatomo Fujisawa, Rei Narikawa, Shin-ichi Maeda, Satoru Watanabe, Yu Kanesaki, Koichi Kobayashi, Jiro Nomata, Mitsumasa Hanaoka, Mai Watanabe, Shigeki Ehira, Eiji Suzuki, Koichiro Awai, Yasukazu Nakamura", "journals/nar/FujisawaNMWKKNH17", "Journal Articles"
"10.1093/nar/gkw1062", "The neXtProt knowledgebase on human proteins: 2017 update.", "Nucleic Acids Res.", "2017", "Pascale Gaudet, Pierre-André Michel, Monique Zahn-Zabal, Aurore Britan, Isabelle Cusin, Marcin Domagalski, Paula Duek Roggli, Alain Gateau, Anne Gleizes, Valérie Hinard, Valentine Rech de Laval, JinJin Lin, Frédéric Nikitin, Mathieu Schaeffer, Daniel Dinis Teixeira, Lydie Lane, Amos Bairoch", "journals/nar/GaudetMZBCDDGGH17", "Journal Articles"
"10.1093/nar/gkw962", "Protein Data Bank Japan (PDBj): updated user interfaces, resource description framework, analysis tools for large structures.", "Nucleic Acids Res.", "2017", "Akira R. Kinjo, Gert-Jan Bekker, Hirofumi Suzuki, Yuko Tsuchiya, Takeshi Kawabata, Yasuyo Ikegawa, Haruki Nakamura", "journals/nar/KinjoBSTKIN17", "Journal Articles"
"10.1093/nar/gkw995", "Update of the FANTOM web resource: high resolution transcriptome of diverse cell types in mammals.", "Nucleic Acids Res.", "2017", "Marina Lizio, Jayson Harshbarger, Imad Abugessaisa, Shuei Noguchi, Atsushi Kondo, Jessica Severin, Chris Mungall, David J. Arenillas, Anthony Mathelier, Yulia A. Medvedeva, Andreas Lennartsson, Finn Drabløs, Jordan A. Ramilowski, Owen J. L. Rackham, Julian Gough, Robin Andersson, Albin Sandelin, Hans Ienasescu, Hiromasa Ono, Hidemasa Bono, Yoshihide Hayashizaki, Piero Carninci, Alistair R. R. Forrest, Takeya Kasukawa, Hideya Kawaji", "journals/nar/LizioHANKSMAMML17", "Journal Articles"
"10.1093/nar/gkw990", "Updates in Rhea - an expert curated resource of biochemical reactions.", "Nucleic Acids Res.", "2017", "Anne Morgat, Thierry Lombardot, Kristian B. Axelsen, Lucila Aimo, Anne Niknejad, Nevila Hyka-Nouspikel, Elisabeth Coudert, Monica Pozzato, Marco Pagni, Sébastien Moretti, Steven Rosanoff, Joseph Onwubiko, Lydie Bougueleret, Ioannis Xenarios, Nicole Redaschi, Alan J. Bridge", "journals/nar/MorgatLAANHCPPM17", "Journal Articles"
"10.1093/nar/gkw1118", "PubChem BioAssay: 2017 update.", "Nucleic Acids Res.", "2017", "Yanli Wang, Stephen H. Bryant, Tiejun Cheng, Jiyao Wang, Asta Gindulyte, Benjamin A. Shoemaker, Paul A. Thiessen, Siqian He, Jian Zhang 0038", "journals/nar/WangBCWGSTHZ17", "Journal Articles"
"10.1093/nar/gkx374", "PharmMapper 2017 update: a web server for potential drug target identification with a comprehensive target pharmacophore database.", "Nucleic Acids Res.", "2017", "Xia Wang, Yihang Shen, Shiwei Wang, Shiliang Li, Weilin Zhang, Xiaofeng Liu 0005, Luhua Lai, Jianfeng Pei, Honglin Li 0003", "journals/nar/WangSWLZLLPL17", "Journal Articles"
"10.1093/nar/gkw1052", "RAID v2.0: an updated resource of RNA-associated interactions across organisms.", "Nucleic Acids Res.", "2017", "Ying Yi, Yue Zhao, Chunhua Li 0004, Lin Zhang 0057, Huiying Huang, Yana Li, Lanlan Liu, Ping Hou, Tianyu Cui, Puwen Tan, Yongfei Hu, Ting Zhang, Yan Huang, Xiaobo Li, Jia Yu, Dong Wang 0011", "journals/nar/YiZLZHLLHCTHZHL17", "Journal Articles"
"10.1109/tem.2017.2648516", "A Markov-Based Update Policy for Constantly Changing Database Systems.", "IEEE Trans. Engineering Management", "2017", "Wei Zong, Feng Wu, Zhengrui Jiang", "journals/tem/ZongWJ17", "Journal Articles"
"10.1145/3041040", "Editorial: Updates to the Editorial Board.", "ACM Trans. Database Syst.", "2017", "Christian S. Jensen", "journals/tods/Jensen17", "Journal Articles"
"10.1093/bib/bbv094", "Updates on drug-target network; facilitating polypharmacology and data integration by growth of DrugBank database.", "Briefings Bioinform.", "2016", "Farnaz Barneh, Mohieddin Jafari, Mehdi Mirzaie", "journals/bib/BarnehJM16", "Journal Articles"
"10.3390/ijgi5060080", "Propagating Updates of Residential Areas in Multi-Representation Databases Using Constrained Delaunay Triangulations.", "ISPRS Int. J. Geo Inf.", "2016", "Xinchang Zhang 0002, Taisheng Guo, Jianfeng Huang, Qinchuan Xin", "journals/ijgi/ZhangGHX16", "Journal Articles"
"10.1093/nar/gkv1123", "NCG 5.0: updates of a manually curated repository of cancer genes and associated properties from cancer mutational screenings.", "Nucleic Acids Res.", "2016", "Omer An, Giovanni Marco Dall&apos;Olio, Thanos P. Mourikis, Francesca D. Ciccarelli", "journals/nar/AnDMC16", "Journal Articles"
"10.1093/nar/gkv1003", "MitoCarta2.0: an updated inventory of mammalian mitochondrial proteins.", "Nucleic Acids Res.", "2016", "Sarah E. Calvo, Karl R. Clauser, Vamsi K. Mootha", "journals/nar/CalvoCM16", "Journal Articles"
"10.1093/nar/gkv1035", "PlantPAN 2.0: an update of plant promoter analysis navigator for reconstructing transcriptional regulatory networks in plants.", "Nucleic Acids Res.", "2016", "Chi-Nga Chow, Han-Qin Zheng, Nai-Yun Wu, Chia-Hung Chien, Hsien-Da Huang, Tzong-Yi Lee, Yi-Fan Chiang-Hsieh, Ping-Fu Hou, Tien-Yi Yang, Wen-Chi Chang", "journals/nar/ChowZWCHLCHYC16", "Journal Articles"
"10.1093/nar/gkv1291", "ELM 2016 - data update and new functionality of the eukaryotic linear motif resource.", "Nucleic Acids Res.", "2016", "Holger Dinkel, Kim Van Roey, Sushama Michael, Manjeet Kumar, Bora Uyar, Brigitte Altenberg, Vladislava Milchevskaya, Melanie Schneider, Helen Kühn, Annika Behrendt, Sophie Luise Dahl, Victoria Damerell, Sandra Diebel, Sara Kalman, Steffen Klein, Arne C. Knudsen, Christina Mäder, Sabina Merrill, Angelina Staudt, Vera Thiel, Lukas Welti, Norman E. Davey, Francesca Diella, Toby J. Gibson", "journals/nar/DinkelRMKUAMSKB16", "Journal Articles"
"10.1093/nar/gkv1269", "EffectiveDB - updates and novel features for a better annotation of bacterial secreted proteins and Type III, IV, VI secretion systems.", "Nucleic Acids Res.", "2016", "Valerie Eichinger, Thomas Nussbaumer, Alexander Platzer, Marc-André Jehl, Roland Arnold, Thomas Rattei", "journals/nar/EichingerNPJAR16", "Journal Articles"
"10.1093/nar/gkv1030", "canSAR: an updated cancer research and drug discovery knowledgebase.", "Nucleic Acids Res.", "2016", "Joseph E. Tym, Costas Mitsopoulos, Elizabeth A. Coker, Parisa Razaz, Amanda C. Schierz, Albert A. Antolin, Bissan Al-Lazikani", "journals/nar/TymMCRSAA16", "Journal Articles"
"10.1093/nar/gkv1339", "An updated version of NPIDB includes new classifications of DNA-protein complexes and their families.", "Nucleic Acids Res.", "2016", "Olga Zanegina, Dmitry D. Kirsanov, Eugene Baulin, Anna S. Karyagina, Andrei Alexeevski, Sergei A. Spirin", "journals/nar/ZaneginaKBKAS16", "Journal Articles"
"10.1093/nar/gkv1268", "TSGene 2.0: an updated literature-based knowledgebase for tumor suppressor genes.", "Nucleic Acids Res.", "2016", "Min Zhao 0006, Pora Kim, Ramkrishna Mitra, Junfei Zhao, Zhongming Zhao", "journals/nar/ZhaoKMZZ16", "Journal Articles"
"10.1145/2893581", "Editorial: Updates to the Editorial Board.", "ACM Trans. Database Syst.", "2016", "Christian S. Jensen", "journals/tods/Jensen16", "Journal Articles"
"10.1109/wcnc.2016.7564713", "Knowledge-based update of primary exclusive region for database-driven spectrum sharing towards 5G.", "WCNC", "2016", "Shota Yamashita, Koji Yamamoto 0001, Takayuki Nishio, Masahiro Morikura", "conf/wcnc/YamashitaYNM16a", "Conference and Workshop Papers"
"10.1093/nar/gku1123", "arrayMap 2014: an updated cancer genome resource.", "Nucleic Acids Res.", "2015", "Haoyang Cai, Saumya Gupta, Prisni Rath, Ni Ai, Michael Baudis", "journals/nar/CaiGRAB15", "Journal Articles"
"10.1093/nar/gku1202", "GRASP v2.0: an update on the Genome-Wide Repository of Associations between SNPs and phenotypes.", "Nucleic Acids Res.", "2015", "John D. Eicher, Christa Landowski, Brian Stackhouse, Arielle Sloan, Wenjie Chen, Nicole Jensen, Ju-Ping Lien, Richard Leslie, Andrew D. Johnson", "journals/nar/EicherLSSCJLLJ15", "Journal Articles"
"10.1093/nar/gku1117", "VectorBase: an updated bioinformatics resource for invertebrate vectors and other organisms related with human diseases.", "Nucleic Acids Res.", "2015", "Gloria I. Giraldo-Calderón, Scott J. Emrich, Robert M. MacCallum, Gareth Maslen, Emmanuel Dialynas, Pantelis Topalis, Nicholas Ho, Sandra Gesing, Gregory R. Madey, Frank H. Collins, Daniel Lawson", "journals/nar/Giraldo-CalderonEMMDTHGMCL15", "Journal Articles"
"10.1093/nar/gku1073", "The UCSC Cancer Genomics Browser: update 2015.", "Nucleic Acids Res.", "2015", "Mary Goldman, Brian Craft, Teresa Swatloski, Melissa S. Cline, Olena Morozova, Mark Diekhans, David Haussler, Jingchun Zhu", "journals/nar/GoldmanCSCMDHZ15", "Journal Articles"
"10.1093/nar/gku1166", "Allele frequency net 2015 update: new features for HLA epitopes, KIR and disease and HLA adverse drug reaction associations.", "Nucleic Acids Res.", "2015", "Faviel F. Gonzalez-Galarza, Louise Y. C. Takeshita, Eduardo José Melo dos Santos, Felicity Kempson, Maria Helena Thomaz Maia, Andrea Luciana Soares da Silva, André Luiz Teles e Silva, Gurpreet S. Ghattaoraya, Ana Alfirevic, Andrew R. Jones, Derek Middleton", "journals/nar/Gonzalez-GalarzaTSKMSSGAJM15", "Journal Articles"
"10.1093/nar/gku1144", "PoSSuM v.2.0: data update and a new function for investigating ligand analogs and target proteins of small-molecule drugs.", "Nucleic Acids Res.", "2015", "Jun-Ichi Ito, Kazuyoshi Ikeda, Kazunori D. Yamada, Kenji Mizuguchi, Kentaro Tomii", "journals/nar/ItoIYMT15", "Journal Articles"
"10.1093/nar/gku1057", "ArrayExpress update - simplifying data submissions.", "Nucleic Acids Res.", "2015", "Nikolay Kolesnikov, Emma Hastings, Maria Keays, Olga Melnichuk, Y. Amy Tang, Eleanor Williams, Miroslaw Dylag, Natalja Kurbatova, Marco Brandizi, Tony Burdett, Karyn Megy, Ekaterina Pilicheva, Gabriella Rustici, Andrew Tikhonov, Helen E. Parkinson, Robert Petryszak, Ugis Sarkans, Alvis Brazma", "journals/nar/KolesnikovHKMTWDKBBMPRTPPSB15", "Journal Articles"
"10.1093/nar/gku1220", "OrthoDB v8: update of the hierarchical catalog of orthologs and the underlying free software.", "Nucleic Acids Res.", "2015", "Evgenia V. Kriventseva, Fredrik Tegenfeldt, Tom J. Petty, Robert M. Waterhouse, Felipe A. Simão, Igor A. Pozdnyakov, Panagiotis Ioannidis 0001, Evgeny M. Zdobnov", "journals/nar/KriventsevaTPWSPIZ15", "Journal Articles"
"10.1093/nar/gku949", "SMART: recent updates, new developments and status in 2015.", "Nucleic Acids Res.", "2015", "Ivica Letunic, Tobias Doerks, Peer Bork", "journals/nar/LetunicDB15", "Journal Articles"
"10.1093/nar/gku1112", "Genomicus update 2015: KaryoView and MatrixView provide a genome-wide perspective to multispecies comparative genomics.", "Nucleic Acids Res.", "2015", "Alexandra Louis, Nga Thi Thuy Nguyen, Matthieu Muffato, Hugues Roest Crollius", "journals/nar/LouisNMC15", "Journal Articles"
"10.1093/nar/gku1114", "SEVA 2.0: an update of the Standard European Vector Architecture for de-/re-construction of bacterial functionalities.", "Nucleic Acids Res.", "2015", "Esteban Martínez-García, Tomás Aparicio, Ángel Goñi-Moreno, Sofía Fraile, Víctor de Lorenzo", "journals/nar/Martinez-GarciaAMFL15", "Journal Articles"
"10.1093/nar/gku961", "Updates in Rhea - a manually curated resource of biochemical reactions.", "Nucleic Acids Res.", "2015", "Anne Morgat, Kristian B. Axelsen, Thierry Lombardot, Rafael Alcántara, Lucila Aimo, Mohamed Zerara, Anne Niknejad, Eugeni Belda, Nevila Hyka-Nouspikel, Elisabeth Coudert, Nicole Redaschi, Lydie Bougueleret, Christoph Steinbeck, Ioannis Xenarios, Alan J. Bridge", "journals/nar/MorgatALAAZNBHCRBSXB15", "Journal Articles"
"10.1093/nar/gku1002", "HAMAP in 2015: updates to the protein family classification and annotation system.", "Nucleic Acids Res.", "2015", "Ivo Pedruzzi, Catherine Rivoire, Andrea H. Auchincloss, Elisabeth Coudert, Guillaume Keller, Edouard De Castro, Delphine Baratin, Béatrice A. Cuche, Lydie Bougueleret, Sylvain Poux, Nicole Redaschi, Ioannis Xenarios, Alan J. Bridge", "journals/nar/PedruzziRACKCBCBPRXB15", "Journal Articles"
"10.1093/nar/gku1062", "Update on RefSeq microbial genomes resources.", "Nucleic Acids Res.", "2015", "Tatiana A. Tatusova, Stacy Ciufo, Scott Federhen, Boris Fedorov, Richard McVeigh, Kathleen O&apos;Neill, Igor Tolstoy, Leonid Zaslavsky", "journals/nar/TatusovaCFFMOTZ15", "Journal Articles"
"10.3390/rs71014119", "Effective Generation and Update of a Building Map Database Through Automatic Building Change Detection from LiDAR Point Cloud Data.", "Remote. Sens.", "2015", "Mohammad Awrangjeb", "journals/remotesensing/Awrangjeb15", "Journal Articles"
"10.1145/2699484", "Online Updates on Data Warehouses via Judicious Use of Solid-State Storage.", "ACM Trans. Database Syst.", "2015", "Manos Athanassoulis, Shimin Chen, Anastasia Ailamaki, Phillip B. Gibbons, Radu Stoica", "journals/tods/AthanassoulisCA15", "Journal Articles"
"10.1145/2747020", "Editorial: Updates to the Editorial Board.", "ACM Trans. Database Syst.", "2015", "Christian S. Jensen", "journals/tods/Jensen15", "Journal Articles"
"10.1093/nar/gkt1268", "Virus Variation Resource - recent updates and future directions.", "Nucleic Acids Res.", "2014", "J. Rodney Brister, Yiming Bao, Sergey A. Zhdanov, Yuri Ostapchuck, Vyacheslav Chetvernin, Boris Kiryutin, Leonid Zaslavsky, Michael Kimelman, Tatiana A. Tatusova", "journals/nar/BristerBZOCKZKT14", "Journal Articles"
"10.1093/nar/gkt1182", "canSAR: updated cancer research and drug discovery knowledgebase.", "Nucleic Acids Res.", "2014", "Krishna C. Bulusu, Joseph E. Tym, Elizabeth A. Coker, Amanda C. Schierz, Bissan Al-Lazikani", "journals/nar/BulusuTCSA14", "Journal Articles"
"10.1093/nar/gkt1202", "NGSmethDB: an updated genome resource for high quality, single-cytosine resolution methylomes.", "Nucleic Acids Res.", "2014", "Stefanie Geisen, Guillermo Barturen, Ángel M. Alganza, Michael Hackenberg, José L. Oliver", "journals/nar/GeisenBAHO14", "Journal Articles"
"10.1093/nar/gkt1266", "miRTarBase update 2014: an information resource for experimentally validated miRNA-target interactions.", "Nucleic Acids Res.", "2014", "Sheng-Da Hsu, Yu-Ting Tseng, Sirjana Shrestha, Yu-Ling Lin, Anas Khaleel, Chih-Hung Chou, Chao-Fang Chu, Hsi-Yuan Huang, Ching-Min Lin, Shu-Yi Ho, Ting-Yan Jian, Feng-Mao Lin, Tzu-Hao Chang, Shun-Long Weng, Kuang-Wen Liao, I-En Liao, Chun-Chi Liu, Hsien-Da Huang", "journals/nar/HsuTSLKCCHLHJLCWLLLH14", "Journal Articles"
"10.1093/nar/gkt1247", "ASD v2.0: updated content and novel features focusing on allosteric regulation.", "Nucleic Acids Res.", "2014", "Zhimin Huang, Linkai Mou, Qiancheng Shen, Shaoyong Lu, Chuangang Li, Xinyi Liu 0003, Guanqiao Wang, Shuai Li, Lv Geng, Yaqin Liu, Jiawei Wu, Guoqiang Chen, Jian Zhang 0037", "journals/nar/HuangMSLLLWLGLWCZ14", "Journal Articles"
"10.1093/nar/gkt1069", "The genome portal of the Department of Energy Joint Genome Institute: 2014 updates.", "Nucleic Acids Res.", "2014", "Henrik Nordberg, Michael Cantor, Serge Dusheyko, Susan Hua, Alexander Poliakov, Igor Shabalov, Tatyana Smirnova, Igor V. Grigoriev, Inna Dubchak", "journals/nar/NordbergCDHPSSGD14", "Journal Articles"
"10.1093/nar/gkt1114", "RefSeq: an update on mammalian reference sequences.", "Nucleic Acids Res.", "2014", "Kim D. Pruitt, Garth R. Brown, Susan M. Hiatt, Françoise Thibaud-Nissen, Alexander Astashyn, Olga D. Ermolaeva, Catherine M. Farrell, Jennifer Hart, Melissa J. Landrum, Kelly M. McGarvey, Michael R. Murphy, Nuala A. O&apos;Leary, Shashikant Pujar, Bhanu Rajput, Sanjida H. Rangwala, Lillian D. Riddick, Andrei Shkeda, Hanzhen Sun, Pamela Tamez, Raymond E. Tully, Craig Wallin, David Webb, Janet Weber, Wendy Wu, Michael DiCuccio, Paul A. Kitts, Donna R. Maglott, Terence D. Murphy, James M. Ostell", "journals/nar/PruittBHTAEFHLMMOPRRRSSTTWWWWDKMMO14", "Journal Articles"
"10.1093/nar/gkt978", "PubChem BioAssay: 2014 update.", "Nucleic Acids Res.", "2014", "Yanli Wang, Tugba O. Suzek, Jian Zhang 0038, Jiyao Wang, Siqian He, Tiejun Cheng, Benjamin A. Shoemaker, Asta Gindulyte, Stephen H. Bryant", "journals/nar/WangSZWHCSGB14", "Journal Articles"
"10.1016/j.compenvurbsys.2014.03.003", "Corrigendum to &quot;The Puget Sound environmental atlas update: Context and GIS database integration issues&quot; [Comput. Environ. Urban Syst. 17(5) (1993) 409-424].", "Comput. Environ. Urban Syst.", "2014", "Edward K. Needham, Elizabeth L. Lanzer", "journals/urban/NeedhamL14", "Journal Articles"
"10.1093/nar/gks1193", "NCBI GEO: archive for functional genomics data sets - update.", "Nucleic Acids Res.", "2013", "Tanya Barrett, Stephen E. Wilhite, Pierre Ledoux, Carlos Evangelista, Irene F. Kim, Maxim Tomashevsky, Kimberly A. Marshall, Katherine H. Phillippy, Patti M. Sherman, Michelle Holko, Andrey Yefanov, Hyeseung Lee, Naigong Zhang, Cynthia L. Robertson, Nadezhda Serova, Sean R. Davis, Alexandra Soboleva", "journals/nar/BarrettWLEKTMPSHYLZRSDS13", "Journal Articles"
"10.1093/nar/gks1147", "InnateDB: systems biology of innate immunity and beyond - recent updates and continuing curation.", "Nucleic Acids Res.", "2013", "Karin Breuer, Amir K. Foroushani, Matthew R. Laird, Carol Chen, Anastasia Sribnaia, Raymond Lo, Geoffrey L. Winsor, Robert E. W. Hancock, Fiona S. L. Brinkman, David J. Lynn", "journals/nar/BreuerFLCSLWHBL13", "Journal Articles"
"10.1093/nar/gks1008", "The UCSC Cancer Genomics Browser: update 2013.", "Nucleic Acids Res.", "2013", "Mary Goldman, Brian Craft, Teresa Swatloski, Kyle Ellrott, Melissa S. Cline, Mark Diekhans, Singer Ma, Chris Wilks, Joshua M. Stuart, David Haussler, Jingchun Zhu", "journals/nar/GoldmanCSECDMWSHZ13", "Journal Articles"
"10.1093/nar/gks1105", "TropGeneDB, the multi-tropical crop information system updated and extended.", "Nucleic Acids Res.", "2013", "Chantal Hamelin, Guilhem Sempéré, Vincent Jouffe, Manuel Ruiz", "journals/nar/HamelinSJR13", "Journal Articles"
"10.1093/nar/gks1220", "ViralZone: recent updates to the virus knowledge resource.", "Nucleic Acids Res.", "2013", "Patrick Masson, Chantal Hulo, Edouard De Castro, Hans Bitter, Lore Gruenbaum, Laurent Essioux, Lydie Bougueleret, Ioannis Xenarios, Philippe Le Mercier", "journals/nar/MassonHCBGEBXM13", "Journal Articles"
"10.1093/nar/gks1172", "ENCODE Data in the UCSC Genome Browser: year 5 update.", "Nucleic Acids Res.", "2013", "Kate R. Rosenbloom, Cricket A. Sloan, Venkat S. Malladi, Timothy R. Dreszer, Katrina Learned, Vanessa Kirkup, Matthew C. Wong, Morgan Maddren, Ruihua Fang, Steven G. Heitner, Brian T. Lee, Galt P. Barber, Rachel A. Harte, Mark Diekhans, Jeffrey C. Long, Steven P. Wilder, Ann S. Zweig, Donna Karolchik, Robert M. Kuhn, David Haussler, W. James Kent", "journals/nar/RosenbloomSMDLKWMFHLBHDLWZKKHK13", "Journal Articles"
"10.1093/nar/gks1068", "Update on activities at the Universal Protein Resource (UniProt) in 2013.", "Nucleic Acids Res.", "2013", "", "journals/nar/X13a", "Journal Articles"
"10.1093/nar/gks1087", "SchistoDB: an updated genome resource for the three key schistosomes of humans.", "Nucleic Acids Res.", "2013", "Adhemar Zerlotini, Eric R. G. R. Aguiar, Fudong Yu, Huayong Xu, Yixue Li, Neil D. Young, Robin B. Gasser, Anna V. Protasio, Matthew Berriman, David S. Roos, Jessica C. Kissinger, Guilherme C. Oliveira", "journals/nar/ZerlotiniAYXLYGPBRKO13", "Journal Articles"
